word_english,word_hebrew,description_en
suffer from something,לסבול מ,experience or be subjected to (something bad or unpleasant).
super,מאוד,very; extremely.
swear,להשבע,make a solemn statement or promise undertaking to do something or affirming that something is the case.
suspect,לחשוד,"have an idea or impression of the existence, presence, or truth of (something) without certain proof."
switch,מתג,a device for making and breaking the connection in an electric circuit.
symbol,סמל,"a mark or character used as a conventional representation of an object, function, or process."
table,שולחן,"a piece of furniture with a flat top and one or more legs, providing a level surface for eating, writing, or working."
"take pleasure/pride/an interest, etc.",לקחת הנאה / גאוה / עניין וכו',"feel satisfaction, pride, or enjoyment in."
take sb's place,לקחת את מקוםו של מישהו,occupy someone's position or role in their absence.
tear,דמעה,"a drop of clear salty liquid secreted by glands in a person's eye when they cry or when the eye is irritated. // לקרוע - to separate (something) into parts by pulling it, cutting it, etc. : to rip, split, or open (something) quickly or violently"
term,מונח,"a word or phrase used to describe a thing or to express a concept, especially in a particular kind of language or branch of study."
terminal,תחנה,"a building or building complex containing transport facilities, such as railway stations, airports, bus stations, etc."
that kind/sort of thing,סוג כזה של דבר,used to refer vaguely to something of a particular type or description.
that's it,זהו,used to indicate that something is finished or concluded.
"the following day / morning, etc.",היום / הבוקר וכו' הבא,on the day or morning after the one now being mentioned.
thief,גנב,"a person who steals another person's property, especially by stealth and without using force or violence."
tight,", הדוק, צמוד","fixed, fastened, or closed firmly; hard to move, undo, or open."
tip,עצה,"a piece of advice or useful information, especially about how to do something or about the likely course of events."
tired of doing something,עייף מלעשות משהו,no longer willing to tolerate or endure (something).
tiring,"מעייף, מייגע",causing one to feel tired or weary.
touch,מגע,an act of touching someone or something.
tough,קשה,very difficult to do or deal with
trade,מסחר,the action of buying and selling goods and services.
transfer,להעביר,move (someone or something) from one place to another.
tribe,שבט,"a group of people that includes many families and relatives who have the same language, customs, and beliefs"
trick,קסם,n action that is meant to deceive someone
turn (sb/something) into sb/something,להפוך משהו / מישהו למשהו,change or transform someone or something into someone or something else.
underline,להדגיש,draw a line under (a word or phrase) to give emphasis or indicate special type.
union,איחוד,"the action or fact of joining or being joined, especially in a political context."
use,להשתמש ב,"take, hold, or deploy (something) as a means of accomplishing or achieving something; employ. // שימוש - the act of using something"
via,באמצעות,traveling through (a place) en route to a destination.
victim,קורבן,"a person harmed, injured, or killed as a result of a crime, accident, or other event or action."
warm,לחמם,to become warm or to make (someone or something) warm
weakness,חולשה,the state or condition of lacking strength.
wear (something) out or wear out (something),להתיש,to annoy or bother (someone)
weather forecast,תחזית מזג אוויר,a statement of what the weather is likely to be for a particular period.
weigh,לשקול,"find out how heavy (someone or something) is, typically using scales."
weird,מוזר,suggesting something supernatural; uncanny.
whatever,כל מה ש,"used to emphasize a lack of restriction in referring to any thing or amount, no matter what."
Who cares?,למי  אכפת?,expressing indifference or dismissal of a matter.
wise,חכם,"having or showing experience, knowledge, and good judgment."
wrap,לעטוף,to cover (something) by winding or folding a piece of material around it
Yours sincerely,בברכה,a formula used to end a formal letter when the recipient's name is known.
will,רצון,a person's choice or desire in a particular situation